issue_id,priority,issue_desc,resolution,assignee,document_it,breached
34-291-5214,medium,"Nulla neque libero, convallis eget, eleifend luctus, ultricies eu, nibh.","Donec vitae nisi. Nam ultrices, libero non mattis pulvinar, nulla pede ullamcorper augue, a suscipit nulla elit ac nulla. Sed vel enim sit amet nunc viverra dapibus. Nulla suscipit ligula in lacus.",Pascal Ivett,true,mattis egestas metus
69-296-9248,medium,Vestibulum rutrum rutrum neque.,Nulla tellus. In sagittis dui vel nisl. Duis ac nibh.,Teena Babar,true,primis in
49-026-8466,high,"In hac habitasse platea dictumst. Morbi vestibulum, velit id pretium iaculis, diam erat fermentum justo, nec condimentum neque sapien placerat ante.","Maecenas rhoncus aliquam lacus. Morbi quis tortor id nulla ultrices aliquet. Maecenas leo odio, condimentum id, luctus nec, molestie sed, justo. Pellentesque viverra pede ac diam.",Stephanus Rowes,false,eget vulputate ut
15-826-9829,low,Nulla facilisi. Cras non velit nec nisi vulputate nonummy.,"In sagittis dui vel nisl. Duis ac nibh. Fusce lacus purus, aliquet at, feugiat non, pretium quis, lectus.",Igor Bend,true,sit amet
99-597-4432,low,"Aliquam augue quam, sollicitudin vitae, consectetuer eget, rutrum at, lorem. Integer tincidunt ante vel ipsum.","Vivamus vel nulla eget eros elementum pellentesque. Quisque porta volutpat erat. Quisque erat eros, viverra eget, congue eget, semper rutrum, nulla.",Nickolas Maudlen,false,phasellus in
60-844-3336,critical,Duis aliquam convallis nunc. Proin at turpis a pede posuere nonummy.,"Nam ultrices, libero non mattis pulvinar, nulla pede ullamcorper augue, a suscipit nulla elit ac nulla. Sed vel enim sit amet nunc viverra dapibus. Nulla suscipit ligula in lacus. Curabitur at ipsum ac tellus semper interdum.",Salli Cozens,false,tortor id
52-811-0563,high,Duis mattis egestas metus. Aenean fermentum.,Etiam faucibus cursus urna. Ut tellus. Nulla ut erat id mauris vulputate elementum. Nullam varius.,Pernell Gillooly,false,convallis duis
39-973-9206,medium,"Nullam orci pede, venenatis non, sodales sed, tincidunt eu, felis.",Ut at dolor quis odio consequat varius. Integer ac leo.,Amii Boyda,true,dui maecenas tristique est
57-236-1292,low,"Aliquam augue quam, sollicitudin vitae, consectetuer eget, rutrum at, lorem. Integer tincidunt ante vel ipsum.","Morbi odio odio, elementum eu, interdum eu, tincidunt in, leo. Maecenas pulvinar lobortis est.",Keary Langhorne,false,tempus vel pede morbi
18-626-7614,high,In quis justo.,Praesent blandit lacinia erat. Vestibulum sed magna at nunc commodo placerat.,Gabby Lulham,true,nulla tellus in sagittis
79-209-3385,medium,Nullam sit amet turpis elementum ligula vehicula consequat. Morbi a ipsum.,"Duis bibendum, felis sed interdum venenatis, turpis enim blandit mi, in porttitor pede justo eu massa. Donec dapibus. Duis at velit eu est congue elementum. In hac habitasse platea dictumst.",Alberta Branney,true,eu nibh
20-253-2557,low,Maecenas ut massa quis augue luctus tincidunt. Nulla mollis molestie lorem.,"Donec ut dolor. Morbi vel lectus in quam fringilla rhoncus. Mauris enim leo, rhoncus sed, vestibulum sit amet, cursus id, turpis. Integer aliquet, massa id lobortis convallis, tortor risus dapibus augue, vel accumsan tellus nisi eu orci.",Raoul Westman,false,ac nibh
20-092-9834,high,Suspendisse potenti. Nullam porttitor lacus at turpis.,Maecenas tincidunt lacus at velit. Vivamus vel nulla eget eros elementum pellentesque.,Barde Staveley,true,ipsum dolor sit amet
55-315-4502,low,Integer ac leo.,Donec quis orci eget orci vehicula condimentum. Curabitur in libero ut massa volutpat convallis.,Nikkie Britton,true,tempus vel pede morbi
22-267-9466,high,In hac habitasse platea dictumst. Etiam faucibus cursus urna.,Curabitur gravida nisi at nibh. In hac habitasse platea dictumst.,Taite Attenbarrow,true,ut tellus nulla
29-052-8027,low,Sed vel enim sit amet nunc viverra dapibus.,"In est risus, auctor sed, tristique in, tempus sit amet, sem. Fusce consequat.",Wynne Baudichon,true,maecenas tincidunt lacus at
29-370-7235,low,Nulla justo. Aliquam quis turpis eget elit sodales scelerisque.,"Mauris enim leo, rhoncus sed, vestibulum sit amet, cursus id, turpis. Integer aliquet, massa id lobortis convallis, tortor risus dapibus augue, vel accumsan tellus nisi eu orci. Mauris lacinia sapien quis libero. Nullam sit amet turpis elementum ligula vehicula consequat.",Matti Cherm,true,amet consectetuer adipiscing elit
86-977-8253,low,In sagittis dui vel nisl.,"Proin leo odio, porttitor id, consequat in, consequat ut, nulla. Sed accumsan felis. Ut at dolor quis odio consequat varius. Integer ac leo.",Dasi Raspel,false,aenean lectus pellentesque eget
43-931-1428,low,Morbi non lectus. Aliquam sit amet diam in magna bibendum imperdiet.,"Aenean fermentum. Donec ut mauris eget massa tempor convallis. Nulla neque libero, convallis eget, eleifend luctus, ultricies eu, nibh. Quisque id justo sit amet sapien dignissim vestibulum.",Lindsay Noen,true,nibh in
73-111-5254,low,Suspendisse accumsan tortor quis turpis. Sed ante.,"Vestibulum ac est lacinia nisi venenatis tristique. Fusce congue, diam id ornare imperdiet, sapien urna pretium nisl, ut volutpat sapien arcu sed augue.",Elaina Barry,false,accumsan felis ut
43-599-9591,high,"In tempor, turpis nec euismod scelerisque, quam turpis adipiscing lorem, vitae mattis nibh ligula nec sem.","Aenean sit amet justo. Morbi ut odio. Cras mi pede, malesuada in, imperdiet et, commodo vulputate, justo.",Colman Serjeantson,true,ac enim
70-440-5825,critical,Duis at velit eu est congue elementum.,"Nam dui. Proin leo odio, porttitor id, consequat in, consequat ut, nulla.",Agnese Malbon,true,dui maecenas
00-643-4110,high,Quisque id justo sit amet sapien dignissim vestibulum. Vestibulum ante ipsum primis in faucibus orci luctus et ultrices posuere cubilia Curae; Nulla dapibus dolor vel est.,Nullam molestie nibh in lectus. Pellentesque at nulla. Suspendisse potenti. Cras in purus eu magna vulputate luctus.,Shanan McGrudder,false,dui vel
62-878-3299,medium,Praesent lectus.,Phasellus sit amet erat. Nulla tempus. Vivamus in felis eu sapien cursus vestibulum. Proin eu mi.,Cesya Speariett,true,quam sollicitudin vitae consectetuer
87-371-5586,critical,Donec quis orci eget orci vehicula condimentum.,"Morbi quis tortor id nulla ultrices aliquet. Maecenas leo odio, condimentum id, luctus nec, molestie sed, justo. Pellentesque viverra pede ac diam. Cras pellentesque volutpat dui.",D'arcy Kimbury,true,volutpat quam
79-160-7850,high,Duis bibendum.,"Vivamus in felis eu sapien cursus vestibulum. Proin eu mi. Nulla ac enim. In tempor, turpis nec euismod scelerisque, quam turpis adipiscing lorem, vitae mattis nibh ligula nec sem.",Taddeo Popov,false,sodales scelerisque mauris sit
86-123-9036,high,"In tempor, turpis nec euismod scelerisque, quam turpis adipiscing lorem, vitae mattis nibh ligula nec sem. Duis aliquam convallis nunc.","Cras in purus eu magna vulputate luctus. Cum sociis natoque penatibus et magnis dis parturient montes, nascetur ridiculus mus.",Meredith Benkhe,false,porttitor lacus
71-396-1304,medium,Proin risus.,"Aenean fermentum. Donec ut mauris eget massa tempor convallis. Nulla neque libero, convallis eget, eleifend luctus, ultricies eu, nibh.",Lorens Sleeny,true,primis in faucibus orci
60-805-8707,low,"Integer aliquet, massa id lobortis convallis, tortor risus dapibus augue, vel accumsan tellus nisi eu orci. Mauris lacinia sapien quis libero.",Pellentesque ultrices mattis odio. Donec vitae nisi.,Cherrita Tooher,false,amet lobortis sapien sapien
18-856-0972,medium,In eleifend quam a odio. In hac habitasse platea dictumst.,Sed ante. Vivamus tortor.,Kendall Masic,false,quam sollicitudin
44-163-5123,critical,Suspendisse accumsan tortor quis turpis.,"Mauris ullamcorper purus sit amet nulla. Quisque arcu libero, rutrum ac, lobortis vel, dapibus at, diam.",Mycah Purle,false,ipsum integer a
41-231-9794,critical,"Cum sociis natoque penatibus et magnis dis parturient montes, nascetur ridiculus mus. Vivamus vestibulum sagittis sapien.","Vivamus vel nulla eget eros elementum pellentesque. Quisque porta volutpat erat. Quisque erat eros, viverra eget, congue eget, semper rutrum, nulla.",Sybille Coltart,true,in hac
49-380-9959,critical,"Morbi vel lectus in quam fringilla rhoncus. Mauris enim leo, rhoncus sed, vestibulum sit amet, cursus id, turpis.",Nulla tellus. In sagittis dui vel nisl. Duis ac nibh.,Viv Nance,true,erat fermentum justo nec
08-860-7045,high,Nullam sit amet turpis elementum ligula vehicula consequat.,"Donec semper sapien a libero. Nam dui. Proin leo odio, porttitor id, consequat in, consequat ut, nulla. Sed accumsan felis.",Dilan Negal,false,sit amet
99-226-5891,high,In blandit ultrices enim.,Suspendisse potenti. In eleifend quam a odio. In hac habitasse platea dictumst.,Corrie Gerler,true,commodo vulputate
54-955-1943,medium,Aenean auctor gravida sem. Praesent id massa id nisl venenatis lacinia.,Suspendisse accumsan tortor quis turpis. Sed ante. Vivamus tortor.,Robinet Ishak,false,sodales sed tincidunt eu
36-220-4278,high,Nulla ac enim.,Donec dapibus. Duis at velit eu est congue elementum.,Devora Gossington,false,primis in
22-183-0632,high,Morbi a ipsum. Integer a nibh.,"Vestibulum ac est lacinia nisi venenatis tristique. Fusce congue, diam id ornare imperdiet, sapien urna pretium nisl, ut volutpat sapien arcu sed augue. Aliquam erat volutpat.",Leupold Ewan,false,accumsan tellus nisi eu
76-304-1705,critical,Duis at velit eu est congue elementum.,Ut at dolor quis odio consequat varius. Integer ac leo. Pellentesque ultrices mattis odio.,Tandi Maplethorp,false,vestibulum proin eu mi
85-124-1318,medium,Cras in purus eu magna vulputate luctus.,Aliquam quis turpis eget elit sodales scelerisque. Mauris sit amet eros.,Andrea Schafer,true,donec diam
37-925-5279,low,Pellentesque viverra pede ac diam. Cras pellentesque volutpat dui.,Proin at turpis a pede posuere nonummy. Integer non velit.,Savina Pollastrino,false,luctus tincidunt nulla mollis
23-001-1626,critical,Vestibulum rutrum rutrum neque. Aenean auctor gravida sem.,"Maecenas tincidunt lacus at velit. Vivamus vel nulla eget eros elementum pellentesque. Quisque porta volutpat erat. Quisque erat eros, viverra eget, congue eget, semper rutrum, nulla.",Ula Loalday,true,nonummy integer non velit
97-247-1470,high,Morbi quis tortor id nulla ultrices aliquet.,Suspendisse accumsan tortor quis turpis. Sed ante. Vivamus tortor.,Malorie Marchiso,false,etiam vel augue vestibulum
86-429-9154,medium,"Donec odio justo, sollicitudin ut, suscipit a, feugiat et, eros.","Vivamus vestibulum sagittis sapien. Cum sociis natoque penatibus et magnis dis parturient montes, nascetur ridiculus mus. Etiam vel augue.",Lucita Herreran,true,dui luctus rutrum nulla
50-531-2749,critical,Cras in purus eu magna vulputate luctus.,"Quisque porta volutpat erat. Quisque erat eros, viverra eget, congue eget, semper rutrum, nulla. Nunc purus. Phasellus in felis.",Theda Glassford,false,vulputate justo
30-874-4110,high,Cras pellentesque volutpat dui.,Vivamus tortor. Duis mattis egestas metus. Aenean fermentum. Donec ut mauris eget massa tempor convallis.,Galina Prate,false,nulla tempus vivamus
32-188-6579,high,"Cum sociis natoque penatibus et magnis dis parturient montes, nascetur ridiculus mus. Etiam vel augue.",Suspendisse potenti. In eleifend quam a odio. In hac habitasse platea dictumst. Maecenas ut massa quis augue luctus tincidunt.,Tate Canwell,false,consequat dui nec
29-605-0332,high,Proin eu mi.,Etiam pretium iaculis justo. In hac habitasse platea dictumst. Etiam faucibus cursus urna. Ut tellus.,Farand Luffman,false,nisi venenatis tristique
09-815-2172,low,"Morbi ut odio. Cras mi pede, malesuada in, imperdiet et, commodo vulputate, justo.",Vivamus tortor. Duis mattis egestas metus. Aenean fermentum.,Marty Pykett,true,libero non mattis
93-014-8656,critical,Pellentesque viverra pede ac diam.,"Nam nulla. Integer pede justo, lacinia eget, tincidunt eget, tempus vel, pede.",Sheelah Wallis,false,sapien quis
18-783-6725,medium,Morbi non lectus.,"Integer non velit. Donec diam neque, vestibulum eget, vulputate ut, ultrices vel, augue. Vestibulum ante ipsum primis in faucibus orci luctus et ultrices posuere cubilia Curae; Donec pharetra, magna vestibulum aliquet ultrices, erat tortor sollicitudin mi, sit amet lobortis sapien sapien non mi. Integer ac neque.",Lida Nettle,false,augue quam
12-620-9830,high,"Nam nulla. Integer pede justo, lacinia eget, tincidunt eget, tempus vel, pede.",Etiam justo. Etiam pretium iaculis justo. In hac habitasse platea dictumst.,Bianka Bodleigh,true,pede morbi porttitor
96-273-0210,critical,Donec ut mauris eget massa tempor convallis.,"Donec ut dolor. Morbi vel lectus in quam fringilla rhoncus. Mauris enim leo, rhoncus sed, vestibulum sit amet, cursus id, turpis. Integer aliquet, massa id lobortis convallis, tortor risus dapibus augue, vel accumsan tellus nisi eu orci.",Dorolisa Auston,true,massa quis
33-022-3930,critical,Etiam pretium iaculis justo.,Etiam pretium iaculis justo. In hac habitasse platea dictumst. Etiam faucibus cursus urna. Ut tellus.,Aline Halson,false,posuere cubilia
23-104-9025,high,Integer ac leo.,Sed vel enim sit amet nunc viverra dapibus. Nulla suscipit ligula in lacus.,Sandy Cheke,false,tortor risus
60-522-7925,medium,In hac habitasse platea dictumst.,"In sagittis dui vel nisl. Duis ac nibh. Fusce lacus purus, aliquet at, feugiat non, pretium quis, lectus. Suspendisse potenti.",Rodge Bleas,true,quis augue luctus
36-230-0054,critical,In hac habitasse platea dictumst.,"Aliquam augue quam, sollicitudin vitae, consectetuer eget, rutrum at, lorem. Integer tincidunt ante vel ipsum. Praesent blandit lacinia erat. Vestibulum sed magna at nunc commodo placerat.",Asher Kunisch,false,nunc donec quis
55-995-2185,high,Nulla tellus.,Nulla suscipit ligula in lacus. Curabitur at ipsum ac tellus semper interdum. Mauris ullamcorper purus sit amet nulla.,Andy Lovat,true,lobortis sapien
27-341-5936,low,Etiam vel augue.,"Nam ultrices, libero non mattis pulvinar, nulla pede ullamcorper augue, a suscipit nulla elit ac nulla. Sed vel enim sit amet nunc viverra dapibus. Nulla suscipit ligula in lacus.",Alexis Crowden,true,et commodo vulputate
84-733-6451,critical,Vivamus in felis eu sapien cursus vestibulum. Proin eu mi.,"Aliquam non mauris. Morbi non lectus. Aliquam sit amet diam in magna bibendum imperdiet. Nullam orci pede, venenatis non, sodales sed, tincidunt eu, felis.",Mellisa Tather,true,quis tortor id
26-797-0165,critical,"Morbi sem mauris, laoreet ut, rhoncus aliquet, pulvinar sed, nisl. Nunc rhoncus dui vel sem.","Proin leo odio, porttitor id, consequat in, consequat ut, nulla. Sed accumsan felis. Ut at dolor quis odio consequat varius. Integer ac leo.",Brunhilde Cranna,true,et ultrices
59-855-8317,critical,Mauris ullamcorper purus sit amet nulla.,Duis aliquam convallis nunc. Proin at turpis a pede posuere nonummy.,Deni Siberry,true,massa quis augue luctus
99-966-5141,low,Aenean sit amet justo.,"Mauris enim leo, rhoncus sed, vestibulum sit amet, cursus id, turpis. Integer aliquet, massa id lobortis convallis, tortor risus dapibus augue, vel accumsan tellus nisi eu orci.",Tyrone Kondratyuk,true,morbi quis tortor
72-228-7107,critical,"Curabitur in libero ut massa volutpat convallis. Morbi odio odio, elementum eu, interdum eu, tincidunt in, leo.",Vivamus tortor. Duis mattis egestas metus.,Rowney Farthin,false,aliquet massa id lobortis
80-973-8211,low,Vivamus in felis eu sapien cursus vestibulum.,Nullam sit amet turpis elementum ligula vehicula consequat. Morbi a ipsum. Integer a nibh. In quis justo.,Mala Carlill,true,vestibulum eget vulputate
07-447-8746,medium,"Vestibulum ac est lacinia nisi venenatis tristique. Fusce congue, diam id ornare imperdiet, sapien urna pretium nisl, ut volutpat sapien arcu sed augue.","Aliquam augue quam, sollicitudin vitae, consectetuer eget, rutrum at, lorem. Integer tincidunt ante vel ipsum. Praesent blandit lacinia erat. Vestibulum sed magna at nunc commodo placerat.",Richart Ludmann,false,ante ipsum primis
38-674-7908,medium,"Vestibulum quam sapien, varius ut, blandit non, interdum in, ante. Vestibulum ante ipsum primis in faucibus orci luctus et ultrices posuere cubilia Curae; Duis faucibus accumsan odio.",Cras non velit nec nisi vulputate nonummy. Maecenas tincidunt lacus at velit. Vivamus vel nulla eget eros elementum pellentesque. Quisque porta volutpat erat.,Hildagarde Gallaher,false,nunc nisl duis bibendum
82-189-3815,high,Fusce consequat. Nulla nisl.,"Pellentesque ultrices mattis odio. Donec vitae nisi. Nam ultrices, libero non mattis pulvinar, nulla pede ullamcorper augue, a suscipit nulla elit ac nulla. Sed vel enim sit amet nunc viverra dapibus.",Roselle Readman,false,pellentesque ultrices mattis
62-244-5241,high,Integer a nibh. In quis justo.,"Proin risus. Praesent lectus. Vestibulum quam sapien, varius ut, blandit non, interdum in, ante. Vestibulum ante ipsum primis in faucibus orci luctus et ultrices posuere cubilia Curae; Duis faucibus accumsan odio.",Adrien Lethabridge,false,ipsum integer a
09-783-3952,critical,"Fusce congue, diam id ornare imperdiet, sapien urna pretium nisl, ut volutpat sapien arcu sed augue. Aliquam erat volutpat.","Curabitur in libero ut massa volutpat convallis. Morbi odio odio, elementum eu, interdum eu, tincidunt in, leo. Maecenas pulvinar lobortis est.",Lauren Padgham,false,diam erat fermentum justo
72-738-1619,high,"Fusce lacus purus, aliquet at, feugiat non, pretium quis, lectus.","Donec vitae nisi. Nam ultrices, libero non mattis pulvinar, nulla pede ullamcorper augue, a suscipit nulla elit ac nulla. Sed vel enim sit amet nunc viverra dapibus. Nulla suscipit ligula in lacus.",Merilyn Holdron,true,pretium iaculis diam
94-037-4831,medium,Aenean lectus. Pellentesque eget nunc.,Maecenas pulvinar lobortis est. Phasellus sit amet erat. Nulla tempus.,Ailina Cooksey,true,amet eros suspendisse
57-008-4413,critical,Maecenas rhoncus aliquam lacus. Morbi quis tortor id nulla ultrices aliquet.,Aliquam non mauris. Morbi non lectus.,Emlynne MacCallam,true,leo odio condimentum id
88-950-9777,medium,"Nullam orci pede, venenatis non, sodales sed, tincidunt eu, felis.","Nam dui. Proin leo odio, porttitor id, consequat in, consequat ut, nulla. Sed accumsan felis. Ut at dolor quis odio consequat varius.",Basil Basindale,false,vivamus metus
29-482-2318,critical,Fusce consequat.,Donec dapibus. Duis at velit eu est congue elementum.,Luciano Calveley,true,maecenas rhoncus aliquam
44-457-4547,low,"Nam congue, risus semper porta volutpat, quam pede lobortis ligula, sit amet eleifend pede libero quis orci. Nullam molestie nibh in lectus.","Nulla neque libero, convallis eget, eleifend luctus, ultricies eu, nibh. Quisque id justo sit amet sapien dignissim vestibulum. Vestibulum ante ipsum primis in faucibus orci luctus et ultrices posuere cubilia Curae; Nulla dapibus dolor vel est.",Goldina Schuelcke,false,integer non velit
46-903-8824,low,"In est risus, auctor sed, tristique in, tempus sit amet, sem. Fusce consequat.",Vestibulum ante ipsum primis in faucibus orci luctus et ultrices posuere cubilia Curae; Mauris viverra diam vitae quam. Suspendisse potenti. Nullam porttitor lacus at turpis. Donec posuere metus vitae ipsum.,Klement Ditty,true,nulla nunc
28-242-4025,medium,"Morbi sem mauris, laoreet ut, rhoncus aliquet, pulvinar sed, nisl. Nunc rhoncus dui vel sem.",Fusce consequat. Nulla nisl.,Andy Harpin,false,pharetra magna ac
11-291-0115,medium,In congue. Etiam justo.,"Cum sociis natoque penatibus et magnis dis parturient montes, nascetur ridiculus mus. Vivamus vestibulum sagittis sapien.",Clementia Vicker,false,amet erat
76-146-6352,low,Vestibulum rutrum rutrum neque.,"Vestibulum ante ipsum primis in faucibus orci luctus et ultrices posuere cubilia Curae; Nulla dapibus dolor vel est. Donec odio justo, sollicitudin ut, suscipit a, feugiat et, eros. Vestibulum ac est lacinia nisi venenatis tristique. Fusce congue, diam id ornare imperdiet, sapien urna pretium nisl, ut volutpat sapien arcu sed augue.",Candi Mutlow,true,elit proin interdum
40-381-0544,critical,"In tempor, turpis nec euismod scelerisque, quam turpis adipiscing lorem, vitae mattis nibh ligula nec sem.",Phasellus sit amet erat. Nulla tempus.,Dorthy Beinisch,true,neque libero
15-520-2053,low,Nam dui.,Nulla ut erat id mauris vulputate elementum. Nullam varius. Nulla facilisi. Cras non velit nec nisi vulputate nonummy.,Derick Halso,true,sed accumsan felis
34-494-3568,critical,Ut at dolor quis odio consequat varius.,Sed accumsan felis. Ut at dolor quis odio consequat varius. Integer ac leo. Pellentesque ultrices mattis odio.,Caresse Chainey,true,eu magna
46-897-8059,critical,Ut at dolor quis odio consequat varius.,Aliquam quis turpis eget elit sodales scelerisque. Mauris sit amet eros.,Sallee Achrameev,true,sapien placerat ante nulla
40-214-6863,critical,Quisque ut erat.,"Nam dui. Proin leo odio, porttitor id, consequat in, consequat ut, nulla.",Addison Manske,true,sodales scelerisque
99-772-2058,critical,Donec ut dolor. Morbi vel lectus in quam fringilla rhoncus.,"Vestibulum ante ipsum primis in faucibus orci luctus et ultrices posuere cubilia Curae; Nulla dapibus dolor vel est. Donec odio justo, sollicitudin ut, suscipit a, feugiat et, eros. Vestibulum ac est lacinia nisi venenatis tristique.",Joane Howley,true,eros viverra
90-565-3632,critical,Aenean sit amet justo.,"Nam nulla. Integer pede justo, lacinia eget, tincidunt eget, tempus vel, pede. Morbi porttitor lorem id ligula. Suspendisse ornare consequat lectus.",Phyllis Dunridge,false,est donec odio
48-190-3982,low,Duis consequat dui nec nisi volutpat eleifend. Donec ut dolor.,Vestibulum ante ipsum primis in faucibus orci luctus et ultrices posuere cubilia Curae; Mauris viverra diam vitae quam. Suspendisse potenti. Nullam porttitor lacus at turpis. Donec posuere metus vitae ipsum.,Cherri Hovie,true,diam id ornare
50-487-4937,high,Praesent blandit. Nam nulla.,"Vestibulum ac est lacinia nisi venenatis tristique. Fusce congue, diam id ornare imperdiet, sapien urna pretium nisl, ut volutpat sapien arcu sed augue. Aliquam erat volutpat. In congue.",Dixie Ausello,true,vestibulum aliquet
55-043-4414,low,"Duis ac nibh. Fusce lacus purus, aliquet at, feugiat non, pretium quis, lectus.","Nulla suscipit ligula in lacus. Curabitur at ipsum ac tellus semper interdum. Mauris ullamcorper purus sit amet nulla. Quisque arcu libero, rutrum ac, lobortis vel, dapibus at, diam.",Jameson Bineham,false,pede lobortis
17-686-5027,critical,Praesent blandit lacinia erat.,"Integer pede justo, lacinia eget, tincidunt eget, tempus vel, pede. Morbi porttitor lorem id ligula.",Andras Vinall,true,sem sed sagittis nam
00-467-1937,critical,Donec quis orci eget orci vehicula condimentum. Curabitur in libero ut massa volutpat convallis.,"In sagittis dui vel nisl. Duis ac nibh. Fusce lacus purus, aliquet at, feugiat non, pretium quis, lectus.",Gregory Arstall,true,est donec
71-818-0728,medium,"Vestibulum ante ipsum primis in faucibus orci luctus et ultrices posuere cubilia Curae; Donec pharetra, magna vestibulum aliquet ultrices, erat tortor sollicitudin mi, sit amet lobortis sapien sapien non mi. Integer ac neque.","Lorem ipsum dolor sit amet, consectetuer adipiscing elit. Proin risus. Praesent lectus. Vestibulum quam sapien, varius ut, blandit non, interdum in, ante.",Amory Le Brom,false,posuere cubilia
42-234-8742,low,"Maecenas leo odio, condimentum id, luctus nec, molestie sed, justo.",Pellentesque eget nunc. Donec quis orci eget orci vehicula condimentum. Curabitur in libero ut massa volutpat convallis.,Estella Mazin,true,convallis nunc proin
47-788-0166,low,"In blandit ultrices enim. Lorem ipsum dolor sit amet, consectetuer adipiscing elit.","Maecenas tristique, est et tempus semper, est quam pharetra magna, ac consequat metus sapien ut nunc. Vestibulum ante ipsum primis in faucibus orci luctus et ultrices posuere cubilia Curae; Mauris viverra diam vitae quam. Suspendisse potenti.",Glynnis Lauchlan,true,proin leo odio
46-658-6237,low,Sed vel enim sit amet nunc viverra dapibus.,"Nulla neque libero, convallis eget, eleifend luctus, ultricies eu, nibh. Quisque id justo sit amet sapien dignissim vestibulum. Vestibulum ante ipsum primis in faucibus orci luctus et ultrices posuere cubilia Curae; Nulla dapibus dolor vel est.",Scotty Scimonelli,false,molestie sed justo pellentesque
37-383-1964,low,Vestibulum rutrum rutrum neque.,"Pellentesque viverra pede ac diam. Cras pellentesque volutpat dui. Maecenas tristique, est et tempus semper, est quam pharetra magna, ac consequat metus sapien ut nunc.",Whitney Bassilashvili,true,in ante vestibulum
30-749-3413,medium,"Donec odio justo, sollicitudin ut, suscipit a, feugiat et, eros.","Aliquam augue quam, sollicitudin vitae, consectetuer eget, rutrum at, lorem. Integer tincidunt ante vel ipsum. Praesent blandit lacinia erat.",Shaylah Barney,false,etiam pretium
46-310-6973,critical,"Lorem ipsum dolor sit amet, consectetuer adipiscing elit.","Mauris enim leo, rhoncus sed, vestibulum sit amet, cursus id, turpis. Integer aliquet, massa id lobortis convallis, tortor risus dapibus augue, vel accumsan tellus nisi eu orci. Mauris lacinia sapien quis libero.",Trix Severs,false,aliquam sit amet
00-154-1634,critical,Phasellus in felis. Donec semper sapien a libero.,"Integer pede justo, lacinia eget, tincidunt eget, tempus vel, pede. Morbi porttitor lorem id ligula. Suspendisse ornare consequat lectus.",Morton Teasey,false,vehicula consequat morbi
